{
  "schema_version": 1,
  "repo_id": "portfolio",
  "documents": [
    {
      "id": "PPD-PORTFOLIO-ACCEPTANCE-CHECKLIST",
      "title": "Final acceptance checklist",
      "path": "docs/audits/acceptance-checklist.md",
      "type": "reference",
      "status": "draft",
      "owner": "daniel",
      "visibility": "internal",
      "summary": "",
      "domain_tags": [],
      "source_refs": [],
      "related": [
        "docs/audits/documentation-baseline.md",
        "docs/audits/historical-reconciliation.md",
        "docs/governance/documentation-standard.md",
        "docs/governance/sdlc.md"
      ],
      "content_digest": "e6c301ba9e270865"
    },
    {
      "id": "PPD-PORTFOLIO-ADR-0001",
      "title": "ADR-0001 — Adopt a repository-first documentation system",
      "path": "docs/decisions/0001-documentation-system.md",
      "type": "adr",
      "status": "draft",
      "owner": "daniel",
      "visibility": "internal",
      "summary": "",
      "domain_tags": [],
      "source_refs": [],
      "related": [],
      "content_digest": "b4f1bdda89b02f7e"
    },
    {
      "id": "PPD-PORTFOLIO-ADR-0002",
      "title": "ADR-0002 — AI proposal/approval model and per-task model routing",
      "path": "docs/decisions/0002-ai-proposal-approval-model.md",
      "type": "adr",
      "status": "accepted",
      "owner": "daniel",
      "visibility": "internal",
      "summary": "",
      "domain_tags": [],
      "source_refs": [],
      "related": [
        "docs/agents/runtime-knowledge-contract.md",
        "docs/audits/remediation-backlog.md",
        "PeakPerformanceData/peak_performance_data/docs/architecture/ai-agent.md"
      ],
      "content_digest": "0f1660073abe7ad7"
    },
    {
      "id": "PPD-PORTFOLIO-ADR-0003",
      "title": "ADR-0003 — Locale persistence via NEXT_LOCALE cookie and profile preference",
      "path": "docs/decisions/0003-locale-persistence.md",
      "type": "adr",
      "status": "draft",
      "owner": "daniel",
      "visibility": "internal",
      "summary": "",
      "domain_tags": [],
      "source_refs": [
        {
          "path": "src/i18n/routing.config.ts",
          "repo_id": "app",
          "revision": "9617bbbcc00b4b09aeb24d54f6588ab48029458a"
        },
        {
          "path": "src/lib/i18n/locale-preference.ts",
          "repo_id": "app",
          "revision": "9617bbbcc00b4b09aeb24d54f6588ab48029458a"
        },
        {
          "path": "src/app/[locale]/login/page.tsx",
          "repo_id": "app",
          "revision": "9617bbbcc00b4b09aeb24d54f6588ab48029458a"
        },
        {
          "path": "src/components/ui/LanguageSwitcher.tsx",
          "repo_id": "app",
          "revision": "9617bbbcc00b4b09aeb24d54f6588ab48029458a"
        },
        {
          "path": "src/components/ui/LanguageSheet.tsx",
          "repo_id": "app",
          "revision": "9617bbbcc00b4b09aeb24d54f6588ab48029458a"
        },
        {
          "path": "src/app/api/user/language/route.ts",
          "repo_id": "app",
          "revision": "9617bbbcc00b4b09aeb24d54f6588ab48029458a"
        },
        {
          "path": "src/app/api/manifest/route.ts",
          "repo_id": "app",
          "revision": "9617bbbcc00b4b09aeb24d54f6588ab48029458a"
        }
      ],
      "related": [
        "docs/decisions/0002-ai-proposal-approval-model.md"
      ],
      "content_digest": "fd70f9007f52cdb0"
    },
    {
      "id": "PPD-PORTFOLIO-ADR-INDEX",
      "title": "Architecture Decision Records index",
      "path": "docs/decisions/README.md",
      "type": "overview",
      "status": "draft",
      "owner": "daniel",
      "visibility": "internal",
      "summary": "",
      "domain_tags": [],
      "source_refs": [],
      "related": [],
      "content_digest": "ea530eec4717c755"
    },
    {
      "id": "PPD-PORTFOLIO-AGENT-KNOWLEDGE-CONTRACT",
      "title": "Runtime-agent knowledge contract",
      "path": "docs/agents/runtime-knowledge-contract.md",
      "type": "reference",
      "status": "draft",
      "owner": "daniel",
      "visibility": "internal",
      "summary": "",
      "domain_tags": [],
      "source_refs": [],
      "related": [
        "AGENTS.md",
        "docs/governance/documentation-standard.md"
      ],
      "content_digest": "b600287365ede01e"
    },
    {
      "id": "PPD-PORTFOLIO-AGENT-KNOWLEDGE-CONTRACT-LEGACY",
      "title": "Runtime-agent knowledge contract (superseded)",
      "path": "docs/agents/knowledge-contract.md",
      "type": "reference",
      "status": "superseded",
      "owner": "daniel",
      "visibility": "internal",
      "summary": "",
      "domain_tags": [],
      "source_refs": [],
      "related": [
        "AGENTS.md",
        "docs/governance/documentation-standard.md"
      ],
      "content_digest": "ff25ddd63067e123"
    },
    {
      "id": "PPD-PORTFOLIO-AGENTS-NAVIGATION",
      "title": "Agent navigation map",
      "path": "docs/agents/navigation.md",
      "type": "reference",
      "status": "draft",
      "owner": "daniel",
      "visibility": "internal",
      "summary": "",
      "domain_tags": [],
      "source_refs": [],
      "related": [
        "AGENTS.md",
        "docs/agents/runtime-knowledge-contract.md",
        "docs/repositories.json"
      ],
      "content_digest": "83f189e6e72098bb"
    },
    {
      "id": "PPD-PORTFOLIO-ARCH-CONTAINERS",
      "title": "Container architecture (C4 L2)",
      "path": "docs/architecture/containers.md",
      "type": "explanation",
      "status": "draft",
      "owner": "daniel",
      "visibility": "internal",
      "summary": "",
      "domain_tags": [],
      "source_refs": [
        {
          "path": "package.json",
          "repo_id": "app",
          "revision": "86faf8651a0be6f013af1bd49f8b0304f4b5273b"
        },
        {
          "path": "api/main.py",
          "repo_id": "backend",
          "revision": "78fce68afcecccec201cf1116b98c0fe246340ca"
        },
        {
          "path": "src/api/main.py",
          "repo_id": "extraction",
          "revision": "0433060b29a23bd2f29c761c10bcf9af4a58d812"
        },
        {
          "path": "api/main.py",
          "repo_id": "agent",
          "revision": "335e5bc61e2063ab7d2d54050782f80488f4f106"
        }
      ],
      "related": [
        "PPD-PORTFOLIO-ARCH-SYSTEM-CONTEXT",
        "PPD-PORTFOLIO-ARCH-DATA-FLOWS"
      ],
      "content_digest": "db92524e19880ad1"
    },
    {
      "id": "PPD-PORTFOLIO-ARCH-DATA-FLOWS",
      "title": "Cross-service data flows",
      "path": "docs/architecture/data-flows.md",
      "type": "explanation",
      "status": "draft",
      "owner": "daniel",
      "visibility": "internal",
      "summary": "",
      "domain_tags": [],
      "source_refs": [],
      "related": [],
      "content_digest": "8863671b88b57857"
    },
    {
      "id": "PPD-PORTFOLIO-ARCH-DEPLOYMENT",
      "title": "Deployment topology",
      "path": "docs/architecture/deployment.md",
      "type": "explanation",
      "status": "draft",
      "owner": "daniel",
      "visibility": "internal",
      "summary": "",
      "domain_tags": [],
      "source_refs": [
        {
          "path": "vercel.json",
          "repo_id": "app",
          "revision": "86faf8651a0be6f013af1bd49f8b0304f4b5273b"
        },
        {
          "path": "render.yaml",
          "repo_id": "backend",
          "revision": "78fce68afcecccec201cf1116b98c0fe246340ca"
        },
        {
          "path": "docker/docker-compose.yml",
          "repo_id": "extraction",
          "revision": "0433060b29a23bd2f29c761c10bcf9af4a58d812"
        },
        {
          "path": "infra/launchd/",
          "repo_id": "swingvision",
          "revision": "1fe4763785d0318c38969a60c65b97ee57a6428a"
        }
      ],
      "related": [
        "PPD-PORTFOLIO-ARCH-CONTAINERS"
      ],
      "content_digest": "d6f0b55e649c8bd4"
    },
    {
      "id": "PPD-PORTFOLIO-ARCH-OVERVIEW",
      "title": "Architecture overview (needs source linking)",
      "path": "docs/architecture.md",
      "type": "explanation",
      "status": "draft",
      "owner": "daniel",
      "visibility": "internal",
      "summary": "",
      "domain_tags": [],
      "source_refs": [],
      "related": [],
      "content_digest": "332f9d1f66d0eee9"
    },
    {
      "id": "PPD-PORTFOLIO-ARCH-REPOSITORY-GRAPH",
      "title": "Repository and dependency graph",
      "path": "docs/architecture/repository-graph.md",
      "type": "explanation",
      "status": "draft",
      "owner": "daniel",
      "visibility": "internal",
      "summary": "",
      "domain_tags": [],
      "source_refs": [
        {
          "path": ".gitmodules",
          "repo_id": "portfolio",
          "revision": "742306b28a233ab19cdc5d48f813d067397c201a"
        },
        {
          "path": "docs/repositories.json",
          "repo_id": "portfolio",
          "revision": "742306b28a233ab19cdc5d48f813d067397c201a"
        }
      ],
      "related": [
        "PPD-PORTFOLIO-ARCH-CONTAINERS"
      ],
      "content_digest": "0f3cf2c46b688f72"
    },
    {
      "id": "PPD-PORTFOLIO-ARCH-SYSTEM-CONTEXT",
      "title": "System context (C4 L1)",
      "path": "docs/architecture/system-context.md",
      "type": "explanation",
      "status": "draft",
      "owner": "daniel",
      "visibility": "internal",
      "summary": "",
      "domain_tags": [],
      "source_refs": [
        {
          "path": "vercel.json",
          "repo_id": "app",
          "revision": "86faf8651a0be6f013af1bd49f8b0304f4b5273b"
        },
        {
          "path": "render.yaml",
          "repo_id": "backend",
          "revision": "78fce68afcecccec201cf1116b98c0fe246340ca"
        },
        {
          "path": "docker/docker-compose.yml",
          "repo_id": "extraction",
          "revision": "0433060b29a23bd2f29c761c10bcf9af4a58d812"
        }
      ],
      "related": [
        "PPD-PORTFOLIO-ARCH-DATA-FLOWS"
      ],
      "content_digest": "be016419190f8b80"